{
  "$schema": "https://json-schema.org/draft/2020-12/schema",
  "title": "JOVRA export bundle manifest (export.json)",
  "description": "The manifest at the root of an export folder/zip (P1-11, P1-09 Share Pack, 'Export video + analysis'). Sessions travel as their own session.json (same schema as the sidecar); tables as CSV per the contracts in spec/contracts/csv. D5: shared exports exclude audio unless the user turned 'Include audio' on.",
  "$comment": "Schema 1.1.0 (T02) added, all optional: sessions[].eventLogVersion, facesBlurred, sharePack, file roles condensedMatch / highlightReel / viewerHtml. Published and versioned for coaches and future tools (story 219): additive minor versions only within major 1.",
  "type": "object",
  "required": ["schemaVersion", "kind", "exportedAt", "app", "scope", "includesAudio", "includesOriginals", "sessions", "files", "csvContracts"],
  "additionalProperties": false,
  "properties": {
    "schemaVersion": {"$ref": "common.schema.json#/$defs/schemaVersion"},
    "kind": {"const": "jovra.export"},
    "exportedAt": {"$ref": "common.schema.json#/$defs/dateTime"},
    "app": {"$ref": "common.schema.json#/$defs/appInfo"},
    "scope": {"enum": ["session", "allData", "sharePack"]},
    "includesAudio": {"type": "boolean"},
    "includesOriginals": {"type": "boolean"},
    "sessions": {
      "type": "array",
      "items": {
        "type": "object",
        "required": ["id", "title", "path"],
        "additionalProperties": false,
        "properties": {
          "id": {"$ref": "common.schema.json#/$defs/id"},
          "title": {"type": "string", "minLength": 1, "maxLength": 120},
          "path": {"$ref": "common.schema.json#/$defs/relativePath"},
          "sample": {"type": "boolean"},
          "eventLogVersion": {"$ref": "common.schema.json#/$defs/eventLogVersion", "description": "Since 1.1.0. The log version this session's files were built from."}
        }
      }
    },
    "files": {
      "type": "array",
      "items": {
        "type": "object",
        "required": ["path", "role", "bytes", "sha256"],
        "additionalProperties": false,
        "properties": {
          "path": {"$ref": "common.schema.json#/$defs/relativePath"},
          "role": {"enum": ["sessionJson", "equipmentJson", "pointsCsv", "statsCsv", "original", "clip", "condensedMatch", "highlightReel", "voiceNote", "readme", "viewerHtml"], "description": "condensedMatch, highlightReel and viewerHtml (the Share Pack's static index.html) since 1.1.0."},
          "mimeType": {"type": "string", "pattern": "^[a-z]+/[a-z0-9.+-]+$"},
          "bytes": {"type": "integer", "minimum": 0},
          "sha256": {"$ref": "common.schema.json#/$defs/sha256"},
          "sessionId": {"$ref": "common.schema.json#/$defs/id"}
        }
      }
    },
    "csvContracts": {
      "type": "array",
      "items": {
        "type": "object",
        "required": ["name", "version"],
        "additionalProperties": false,
        "properties": {
          "name": {"enum": ["points", "stats"]},
          "version": {"type": "integer", "minimum": 1}
        }
      }
    },
    "contact": {"const": "hello@islanddevcrew.com", "description": "IDC Rule 07: the only public contact, as text."},
    "facesBlurred": {"type": "boolean", "description": "Since 1.1.0. On-device face blur was applied to the video files (estimated; may miss faces)."},
    "sharePack": {
      "description": "Since 1.1.0. Present when scope is sharePack (N3): who it is for and what it holds. Private by default.",
      "type": "object",
      "required": ["audience", "selection"],
      "additionalProperties": false,
      "properties": {
        "audience": {"enum": ["coach", "opponent", "doublesPartner"]},
        "selection": {"enum": ["fullCopy", "selectedPoints", "teamPoints"]},
        "source": {"enum": ["proxy720p", "rallyOnly", "original"]}
      }
    }
  }
}
